{
  "scope": {
    "realm_id": "local-source-chain-test",
    "project_id": "caller-authored-project"
  },
  "baseline": {
    "source_id": "itemized-source-mapping-DID",
    "kind": "document",
    "locator": {
      "kind": "document",
      "provider": "project-files",
      "conversation_id": null,
      "message_id": null,
      "repository_id": null,
      "path": null,
      "document_id": "itemized-source-mapping-DID",
      "artifact_ref": null,
      "observation_id": null
    },
    "capture": {
      "upstream_version": "itemized-baseline-v1",
      "content_digest": {
        "algorithm": "sha256",
        "hex": "bd9b64e28aed0c256b3abb7c3fadaded1c6df7446c2adb6050e81720022bf2cc"
      },
      "kind": "immutable_version"
    },
    "captured_at": "2026-10-14T12:00:00.000000Z",
    "captured_by": {
      "actor_id": "local-source-author",
      "actor_kind": "human",
      "issuer": "controlled-local-caller"
    },
    "media_type": "text/markdown",
    "byte_length": 2632,
    "original_url": null
  },
  "candidate": {
    "source_id": "itemized-source-mapping-DID",
    "kind": "document",
    "locator": {
      "kind": "document",
      "provider": "project-files",
      "conversation_id": null,
      "message_id": null,
      "repository_id": null,
      "path": null,
      "document_id": "itemized-source-mapping-DID",
      "artifact_ref": null,
      "observation_id": null
    },
    "capture": {
      "upstream_version": "itemized-candidate-v2",
      "content_digest": {
        "algorithm": "sha256",
        "hex": "9b535f9703b4ff7e75dd165b26e3ea68c62821998c3a6855371fd06af196c058"
      },
      "kind": "immutable_version"
    },
    "captured_at": "2026-10-14T12:00:00.000000Z",
    "captured_by": {
      "actor_id": "local-source-author",
      "actor_kind": "human",
      "issuer": "controlled-local-caller"
    },
    "media_type": "text/markdown",
    "byte_length": 7848,
    "original_url": null
  },
  "checks": [
    {
      "check_id": "source-version-preservation",
      "claim": "The proposed explicit mappings preserve two different captures of one document at two distinct paths.",
      "evidence": [
        {
          "source_ref": {
            "source_id": "itemized-source-mapping-DID",
            "kind": "document",
            "locator": {
              "kind": "document",
              "provider": "project-files",
              "conversation_id": null,
              "message_id": null,
              "repository_id": null,
              "path": null,
              "document_id": "itemized-source-mapping-DID",
              "artifact_ref": null,
              "observation_id": null
            },
            "capture": {
              "upstream_version": "itemized-candidate-v2",
              "content_digest": {
                "algorithm": "sha256",
                "hex": "9b535f9703b4ff7e75dd165b26e3ea68c62821998c3a6855371fd06af196c058"
              },
              "kind": "immutable_version"
            },
            "captured_at": "2026-10-14T12:00:00.000000Z",
            "captured_by": {
              "actor_id": "local-source-author",
              "actor_kind": "human",
              "issuer": "controlled-local-caller"
            },
            "media_type": "text/markdown",
            "byte_length": 7848,
            "original_url": null
          },
          "excerpt": "## One small change\n\nUse `ProjectSourceMaterials(factory, scope, root, source_mappings)` for the local\nread port. Each mapping is a complete SourceRef plus an explicit safe relative\nfile path. Retain the baseline rule that the host selects only a finite set of\nrefs in one scope, and that the source port is read-only. Replace only the\nbaseline's document-ID-to-file-path inference. Two versions of one document now\nhave two explicit paths, so the caller can preserve both captures without\noverwriting either. There is no automatic source registration or copying by the\nsource port; the caller authors and retains the files."
        },
        {
          "source_ref": {
            "source_id": "source-test-capture",
            "kind": "document",
            "locator": {
              "kind": "document",
              "provider": "project-files",
              "conversation_id": null,
              "message_id": null,
              "repository_id": null,
              "path": null,
              "document_id": "source-test-capture",
              "artifact_ref": null,
              "observation_id": null
            },
            "capture": {
              "upstream_version": "itemized-capture-v1",
              "content_digest": {
                "algorithm": "sha256",
                "hex": "04a8108517c7c848a0f36b88c44fe34ec2b123b9e52ddc9e2f86fbd3003319bb"
              },
              "kind": "immutable_version"
            },
            "captured_at": "2026-10-14T12:00:00.000000Z",
            "captured_by": {
              "actor_id": "local-source-author",
              "actor_kind": "human",
              "issuer": "controlled-local-caller"
            },
            "media_type": "text/markdown",
            "byte_length": 9276,
            "original_url": null
          },
          "excerpt": "def test_same_document_versions_require_distinct_explicit_files(tmp_path):\n    old = b\"DID: old revision\\n\"\n    new = b\"DID: new revision\\n\"\n    (tmp_path / \"archive\").mkdir()\n    (tmp_path / \"archive\" / \"v1.md\").write_bytes(old)\n    (tmp_path / \"current.md\").write_bytes(new)\n    old_ref = _source(\"design.md\", old, version=\"v1\")\n    new_ref = _source(\"design.md\", new, version=\"v2\")\n    reader = ProjectSourceMaterials(object(), scope=SCOPE, root=tmp_path,\n        source_mappings=((old_ref, \"archive/v1.md\"), (new_ref, \"current.md\")))\n    try:\n        assert reader.read(_context(), old_ref) == old\n        assert reader.read(_context(), new_ref) == new\n        missing = _source(\"design.md\", b\"unavailable\", version=\"v3\")\n        with pytest.raises(ApplicationError, match=\"SOURCE_VERSION_MISMATCH\"):\n            reader.read(_context(), missing)\n    finally:\n        reader.close()"
        }
      ]
    },
    {
      "check_id": "scoped-read-boundary",
      "claim": "The source port retains finite read-only selection in the configured scope; it grants no broader source access.",
      "evidence": [
        {
          "source_ref": {
            "source_id": "itemized-source-mapping-DID",
            "kind": "document",
            "locator": {
              "kind": "document",
              "provider": "project-files",
              "conversation_id": null,
              "message_id": null,
              "repository_id": null,
              "path": null,
              "document_id": "itemized-source-mapping-DID",
              "artifact_ref": null,
              "observation_id": null
            },
            "capture": {
              "upstream_version": "itemized-baseline-v1",
              "content_digest": {
                "algorithm": "sha256",
                "hex": "bd9b64e28aed0c256b3abb7c3fadaded1c6df7446c2adb6050e81720022bf2cc"
              },
              "kind": "immutable_version"
            },
            "captured_at": "2026-10-14T12:00:00.000000Z",
            "captured_by": {
              "actor_id": "local-source-author",
              "actor_kind": "human",
              "issuer": "controlled-local-caller"
            },
            "media_type": "text/markdown",
            "byte_length": 2632,
            "original_url": null
          },
          "excerpt": "## Required change and constraints\n\nSeparate logical source identity from an explicitly supplied relative path so\nthe caller can retain v1 and v2 in two different files. Preserve complete ref\nchecking, length/digest checks, scoped finite selection and read-only behavior.\nDo not infer paths or versions, create fallback chains, expand read authority,\nchange public SourceRef or SourceMaterialPort, scan Git/projects, or add a second\nEngineering record owner."
        },
        {
          "source_ref": {
            "source_id": "adapter-capture",
            "kind": "document",
            "locator": {
              "kind": "document",
              "provider": "project-files",
              "conversation_id": null,
              "message_id": null,
              "repository_id": null,
              "path": null,
              "document_id": "adapter-capture",
              "artifact_ref": null,
              "observation_id": null
            },
            "capture": {
              "upstream_version": "itemized-capture-v1",
              "content_digest": {
                "algorithm": "sha256",
                "hex": "b4d039843f035e9ab90c6daf8a5d8c2ac50bae2231c7ccb89d8f63377257bfdf"
              },
              "kind": "immutable_version"
            },
            "captured_at": "2026-10-14T12:00:00.000000Z",
            "captured_by": {
              "actor_id": "local-source-author",
              "actor_kind": "human",
              "issuer": "controlled-local-caller"
            },
            "media_type": "text/markdown",
            "byte_length": 8961,
            "original_url": null
          },